{
  "schema_version": 1,
  "index_kind": "alatyr-context-index",
  "index_id": "project.knowledge-promotions",
  "contour": "project",
  "title": "Project Promotions Context",
  "summary": "Recursive navigation for the project contour at knowledge/promotions.",
  "max_depth": 8,
  "entry_defaults": {
    "load_when": [
      "selected by an exact task, operation, owner, path, fact, contract, dependency, risk, or conflict signal"
    ]
  },
  "entries": [
    {
      "id": "project.content.knowledge-promotions-readme-md",
      "kind": "content",
      "path": "knowledge/promotions/README.md",
      "summary": "Project Knowledge Promotion Records",
      "selectors": {
        "path_terms": [
          "knowledge",
          "promotions"
        ]
      },
      "semantic_refs": [
        "alatyr:bounded-context-expansion@1",
        "alatyr:canonical-owner@1",
        "alatyr:observed-is-not-accepted@1"
      ],
      "owner_refs": [
        "ALATYR-CONTEXT-001",
        "ALATYR-KNOWLEDGE-001",
        "ALATYR-SOURCE-001"
      ],
      "estimated_words": 76,
      "content_digest": "sha256:5cc57a0915e90a49b44cf3813fca741575d16a84f7c5b19b2bbb82dd38fdd0d1"
    }
  ]
}
