{
  "schema_version": 1,
  "index_kind": "alatyr-context-index",
  "index_id": "project.debug-records",
  "contour": "project",
  "title": "Project Records Context",
  "summary": "Recursive navigation for the project contour at debug/records.",
  "max_depth": 8,
  "entry_defaults": {
    "load_when": [
      "selected by an exact task, operation, owner, path, fact, contract, dependency, risk, or conflict signal"
    ]
  },
  "entries": [
    {
      "id": "project.content.debug-records-readme-md",
      "kind": "content",
      "path": "debug/records/README.md",
      "summary": "Debug Records",
      "selectors": {
        "path_terms": [
          "debug",
          "records"
        ]
      },
      "semantic_refs": [
        "alatyr:bounded-context-expansion@1"
      ],
      "owner_refs": [
        "ALATYR-CONTEXT-001"
      ],
      "estimated_words": 370,
      "content_digest": "sha256:3f657b5138398aea32c916af12cbe75c63e80d285ab26f9f2f797a02ba29c2c7"
    }
  ]
}
