{
  "schema_version": 1,
  "index_kind": "alatyr-context-index",
  "index_id": "assistant.change-packages",
  "contour": "assistant",
  "title": "Assistant Change Packages Context",
  "summary": "Recursive navigation for the assistant contour at change-packages.",
  "max_depth": 8,
  "entry_defaults": {
    "load_when": [
      "selected by an exact task, operation, owner, path, fact, contract, dependency, risk, or conflict signal"
    ]
  },
  "entries": [
    {
      "id": "assistant.content.change-packages-index-json",
      "kind": "content",
      "path": "change-packages/index.json",
      "summary": "Index",
      "selectors": {
        "path_terms": [
          "change",
          "packages"
        ]
      },
      "semantic_refs": [
        "alatyr:bounded-context-expansion@1",
        "alatyr:logical-integrity@1"
      ],
      "owner_refs": [
        "ALATYR-CONTEXT-001",
        "ALATYR-INTEGRITY-001"
      ],
      "estimated_words": 10,
      "content_digest": "sha256:c93687c7cab5ff960d4fd8e81232d70fcd56b276fd2dabecd1d42789896fcae3"
    }
  ]
}
