{
  "schema_version": 1,
  "index_kind": "alatyr-context-index",
  "index_id": "project.dependencies-snapshots",
  "contour": "project",
  "title": "Project Snapshots Context",
  "summary": "Recursive navigation for the project contour at dependencies/snapshots.",
  "max_depth": 8,
  "entry_defaults": {
    "load_when": [
      "selected by an exact task, operation, owner, path, fact, contract, dependency, risk, or conflict signal"
    ]
  },
  "entries": [
    {
      "id": "project.content.dependencies-snapshots-readme-md",
      "kind": "content",
      "path": "dependencies/snapshots/README.md",
      "summary": "Dependency Knowledge Snapshots",
      "selectors": {
        "path_terms": [
          "dependencies",
          "snapshots"
        ]
      },
      "semantic_refs": [
        "alatyr:bounded-context-expansion@1"
      ],
      "owner_refs": [
        "ALATYR-CONTEXT-001"
      ],
      "estimated_words": 60,
      "content_digest": "sha256:c68dbbce19632be383bd0b30a4473ea803b908ecb0728803beebf9b6072bb2bd"
    }
  ]
}
