{
  "schema_version": 1,
  "index_kind": "alatyr-context-index",
  "index_id": "assistant.context",
  "contour": "assistant",
  "title": "Assistant Context Context",
  "summary": "Recursive navigation for the assistant contour at context.",
  "max_depth": 8,
  "entry_defaults": {
    "load_when": [
      "selected by an exact task, operation, owner, path, fact, contract, dependency, risk, or conflict signal"
    ]
  },
  "entries": [
    {
      "id": "assistant.content.context-consistency-routing-json",
      "kind": "content",
      "path": "context/consistency-routing.json",
      "summary": "Consistency Routing",
      "selectors": {
        "path_terms": [
          "consistency",
          "routing"
        ]
      },
      "semantic_refs": [
        "alatyr:bounded-context-expansion@1",
        "alatyr:logical-integrity@1"
      ],
      "owner_refs": [
        "ALATYR-CONTEXT-001",
        "ALATYR-INTEGRITY-001"
      ],
      "estimated_words": 131,
      "content_digest": "sha256:0edcc9ac589faa31b29cb5d61306db0f6ba0e7d9c0ce3050347a0eec28767563"
    },
    {
      "id": "assistant.content.context-cost-scenarios-json",
      "kind": "content",
      "path": "context/cost-scenarios.json",
      "summary": "Cost Scenarios",
      "selectors": {
        "path_terms": [
          "cost",
          "scenarios"
        ]
      },
      "semantic_refs": [
        "alatyr:bounded-context-expansion@1"
      ],
      "owner_refs": [
        "ALATYR-CONTEXT-001"
      ],
      "estimated_words": 127,
      "content_digest": "sha256:918d349b17ca1d14fdbfcb4ebfaf0103cb39096fab81ce94467581d513831dd0"
    },
    {
      "id": "assistant.content.context-migration-routing-json",
      "kind": "content",
      "path": "context/migration-routing.json",
      "summary": "Migration Routing",
      "selectors": {
        "path_terms": [
          "migration",
          "routing"
        ]
      },
      "semantic_refs": [
        "alatyr:bounded-context-expansion@1"
      ],
      "owner_refs": [
        "ALATYR-CONTEXT-001"
      ],
      "estimated_words": 131,
      "content_digest": "sha256:81122f34f9fa7ca9b894e6dcaa72f146697fb7cc04d3e63d09533f54c43fe893"
    },
    {
      "id": "assistant.content.context-project-knowledge-routing-json",
      "kind": "content",
      "path": "context/project-knowledge-routing.json",
      "summary": "Project Knowledge Routing",
      "selectors": {
        "path_terms": [
          "project",
          "knowledge",
          "routing"
        ]
      },
      "semantic_refs": [
        "alatyr:bounded-context-expansion@1",
        "alatyr:canonical-owner@1",
        "alatyr:observed-is-not-accepted@1"
      ],
      "owner_refs": [
        "ALATYR-CONTEXT-001",
        "ALATYR-KNOWLEDGE-001",
        "ALATYR-SOURCE-001"
      ],
      "estimated_words": 294,
      "content_digest": "sha256:2eb7f1b84cd7e41e1143445bb25c9af78cbcb008a8c7dc301f4542267ec34d6b"
    },
    {
      "id": "assistant.section.context-intents",
      "kind": "index",
      "path": "context/intents/context-index.json",
      "summary": "Intents section",
      "selectors": {
        "path_terms": [
          "intents"
        ]
      },
      "semantic_refs": [],
      "owner_refs": [],
      "estimated_words": 327,
      "content_digest": "sha256:3d6c72fb3dd383125bab978ee2f548685164bfc3adbac0ebf2ed191342c84a45"
    },
    {
      "id": "assistant.section.context-profiles",
      "kind": "index",
      "path": "context/profiles/context-index.json",
      "summary": "Profiles section",
      "selectors": {
        "path_terms": [
          "profiles"
        ]
      },
      "semantic_refs": [],
      "owner_refs": [],
      "estimated_words": 337,
      "content_digest": "sha256:23731802370eda08198f63845f9d17ec6d9dfe8202561abe9b07d337570b7de7"
    },
    {
      "id": "assistant.section.context-task-scales",
      "kind": "index",
      "path": "context/task-scales/context-index.json",
      "summary": "Task Scales section",
      "selectors": {
        "path_terms": [
          "task-scales"
        ]
      },
      "semantic_refs": [],
      "owner_refs": [],
      "estimated_words": 384,
      "content_digest": "sha256:000097c9485d99dd46bd3b8ffd5a199ea2339cf743d8c2c0e793610bdb409827"
    }
  ]
}
