{
  "schema_version": 1,
  "index_kind": "alatyr-context-index",
  "index_id": "assistant.assistant-capabilities",
  "contour": "assistant",
  "title": "Assistant Assistant Capabilities Context",
  "summary": "Recursive navigation for the assistant contour at assistant-capabilities.",
  "max_depth": 8,
  "entry_defaults": {
    "load_when": [
      "selected by an exact task, operation, owner, path, fact, contract, dependency, risk, or conflict signal"
    ]
  },
  "entries": [
    {
      "id": "assistant.content.assistant-capabilities-generic-json",
      "kind": "content",
      "path": "assistant-capabilities/generic.json",
      "summary": "Generic",
      "selectors": {
        "path_terms": [
          "assistant",
          "capabilities",
          "generic"
        ]
      },
      "semantic_refs": [
        "alatyr:bounded-context-expansion@1"
      ],
      "owner_refs": [
        "ALATYR-CONTEXT-001"
      ],
      "estimated_words": 367,
      "content_digest": "sha256:9899a3563bb43bfcd71d44e3a5966900f65014f9699f08f46e835835b0fe9cee"
    }
  ]
}
