{
  "schema_version": 1,
  "index_kind": "alatyr-context-index",
  "index_id": "assistant.tools",
  "contour": "assistant",
  "title": "Assistant Tools Context",
  "summary": "Recursive navigation for the assistant contour at tools.",
  "max_depth": 8,
  "entry_defaults": {
    "load_when": [
      "selected by an exact task, operation, owner, path, fact, contract, dependency, risk, or conflict signal"
    ]
  },
  "entries": [
    {
      "id": "assistant.content.tools-alatyr-delegate-py",
      "kind": "content",
      "path": "tools/alatyr_delegate.py",
      "summary": "Alatyr Delegate",
      "selectors": {
        "path_terms": [
          "tools",
          "alatyr",
          "delegate"
        ]
      },
      "semantic_refs": [
        "alatyr:bounded-context-expansion@1"
      ],
      "owner_refs": [
        "ALATYR-CONTEXT-001"
      ],
      "estimated_words": 823,
      "content_digest": "sha256:fbe7614f428676b819640a9207eae08c0b8beb9ed28a2c0246d05b1229632dd6"
    }
  ]
}
