{
  "schema_version": 1,
  "index_kind": "alatyr-context-index",
  "index_id": "project.consistency-areas",
  "contour": "project",
  "title": "Project Areas Context",
  "summary": "Recursive navigation for the project contour at consistency/areas.",
  "max_depth": 8,
  "entry_defaults": {
    "load_when": [
      "selected by an exact task, operation, owner, path, fact, contract, dependency, risk, or conflict signal"
    ]
  },
  "entries": [
    {
      "id": "project.content.consistency-areas-template-json",
      "kind": "content",
      "path": "consistency/areas/_template.json",
      "summary": " Template",
      "selectors": {
        "path_terms": [
          "consistency",
          "areas",
          "template"
        ]
      },
      "semantic_refs": [
        "alatyr:bounded-context-expansion@1",
        "alatyr:logical-integrity@1"
      ],
      "owner_refs": [
        "ALATYR-CONTEXT-001",
        "ALATYR-INTEGRITY-001"
      ],
      "estimated_words": 54,
      "content_digest": "sha256:5b095c1012da9ce787b16e14a1cfb959ab16441c7cfd69aa2808308feab1d8b6"
    }
  ]
}
