{
  "schema_version": 1,
  "index_kind": "alatyr-context-index",
  "index_id": "project.architecture",
  "contour": "project",
  "title": "Project Architecture Context",
  "summary": "Recursive navigation for the project contour at architecture.",
  "max_depth": 8,
  "entry_defaults": {
    "load_when": [
      "selected by an exact task, operation, owner, path, fact, contract, dependency, risk, or conflict signal"
    ]
  },
  "entries": [
    {
      "id": "project.content.architecture-catalog-json",
      "kind": "content",
      "path": "architecture/catalog.json",
      "summary": "Catalog",
      "selectors": {
        "path_terms": [
          "architecture",
          "catalog"
        ]
      },
      "semantic_refs": [
        "alatyr:bounded-context-expansion@1",
        "alatyr:canonical-owner@1",
        "alatyr:observed-is-not-accepted@1"
      ],
      "owner_refs": [
        "ALATYR-CONTEXT-001",
        "ALATYR-KNOWLEDGE-001",
        "ALATYR-SOURCE-001"
      ],
      "estimated_words": 112,
      "content_digest": "sha256:62be5880ee6afb8a09fa94a872b4ecf03ce1d72fcd252f06a201ea9e61f1f6cc"
    },
    {
      "id": "project.content.architecture-readme-md",
      "kind": "content",
      "path": "architecture/README.md",
      "summary": "Project Architecture Knowledge",
      "selectors": {
        "path_terms": [
          "architecture"
        ]
      },
      "semantic_refs": [
        "alatyr:bounded-context-expansion@1",
        "alatyr:canonical-owner@1",
        "alatyr:observed-is-not-accepted@1"
      ],
      "owner_refs": [
        "ALATYR-CONTEXT-001",
        "ALATYR-KNOWLEDGE-001",
        "ALATYR-SOURCE-001"
      ],
      "estimated_words": 325,
      "content_digest": "sha256:57ab1c0cc16dd2a4ab4f63d91757d9d359b58a466607893cd675993591f9dcec"
    }
  ]
}
