{
  "schema_version": 1,
  "index_kind": "alatyr-context-index",
  "index_id": "project.documentation",
  "contour": "project",
  "title": "Project Documentation Context",
  "summary": "Recursive navigation for the project contour at documentation.",
  "max_depth": 8,
  "entry_defaults": {
    "load_when": [
      "selected by an exact task, operation, owner, path, fact, contract, dependency, risk, or conflict signal"
    ]
  },
  "entries": [
    {
      "id": "project.content.documentation-catalog-json",
      "kind": "content",
      "path": "documentation/catalog.json",
      "summary": "Catalog",
      "selectors": {
        "path_terms": [
          "documentation",
          "catalog"
        ]
      },
      "semantic_refs": [
        "alatyr:bounded-context-expansion@1"
      ],
      "owner_refs": [
        "ALATYR-CONTEXT-001"
      ],
      "estimated_words": 51,
      "content_digest": "sha256:04dd8b6ea24c3dd603934dd9afc75fc7e409cf9184a0acdae9a1082cad9fa821"
    },
    {
      "id": "project.content.documentation-profiles-json",
      "kind": "content",
      "path": "documentation/profiles.json",
      "summary": "Profiles",
      "selectors": {
        "path_terms": [
          "documentation",
          "profiles"
        ]
      },
      "semantic_refs": [
        "alatyr:bounded-context-expansion@1"
      ],
      "owner_refs": [
        "ALATYR-CONTEXT-001"
      ],
      "estimated_words": 144,
      "content_digest": "sha256:64fcfbfc0fe31f92ee45e0fa7b51fb1f0f9ff2408061e3b630aca0bbc8964a5d"
    },
    {
      "id": "project.content.documentation-readme-md",
      "kind": "content",
      "path": "documentation/README.md",
      "summary": "Project Code Documentation",
      "selectors": {
        "path_terms": [
          "documentation"
        ]
      },
      "semantic_refs": [
        "alatyr:bounded-context-expansion@1"
      ],
      "owner_refs": [
        "ALATYR-CONTEXT-001"
      ],
      "estimated_words": 254,
      "content_digest": "sha256:117700f1a2830c1e1b33e8db6afd76604b93099135a607bb3dd240df6c5f0e89"
    }
  ]
}
