{
  "schema_version": 1,
  "index_kind": "alatyr-context-index",
  "index_id": "project.consistency",
  "contour": "project",
  "title": "Project Consistency Context",
  "summary": "Recursive navigation for the project contour at consistency.",
  "max_depth": 8,
  "entry_defaults": {
    "load_when": [
      "selected by an exact task, operation, owner, path, fact, contract, dependency, risk, or conflict signal"
    ]
  },
  "entries": [
    {
      "id": "project.content.consistency-relationship-candidates-json",
      "kind": "content",
      "path": "consistency/relationship-candidates.json",
      "summary": "Relationship Candidates",
      "selectors": {
        "path_terms": [
          "consistency",
          "relationship",
          "candidates"
        ]
      },
      "semantic_refs": [
        "alatyr:bounded-context-expansion@1",
        "alatyr:logical-integrity@1"
      ],
      "owner_refs": [
        "ALATYR-CONTEXT-001",
        "ALATYR-INTEGRITY-001"
      ],
      "estimated_words": 8,
      "content_digest": "sha256:a210c6e869c2382011d67f4a512cb8502fd9574ea12ee996ec4789019232b039"
    },
    {
      "id": "project.section.consistency-areas",
      "kind": "index",
      "path": "consistency/areas/context-index.json",
      "summary": "Areas section",
      "selectors": {
        "path_terms": [
          "areas"
        ]
      },
      "semantic_refs": [],
      "owner_refs": [],
      "estimated_words": 83,
      "content_digest": "sha256:3612f40e12b5a7f373b597204612afa507378cde1671aefa73641e6b689fc9d0"
    }
  ]
}
