{
  "schema_version": 1,
  "index_kind": "alatyr-context-index",
  "index_id": "project.debug",
  "contour": "project",
  "title": "Project Debug Context",
  "summary": "Recursive navigation for the project contour at debug.",
  "max_depth": 8,
  "entry_defaults": {
    "load_when": [
      "selected by an exact task, operation, owner, path, fact, contract, dependency, risk, or conflict signal"
    ]
  },
  "entries": [
    {
      "id": "project.content.debug-index-json",
      "kind": "content",
      "path": "debug/index.json",
      "summary": "Index",
      "selectors": {
        "path_terms": [
          "debug"
        ]
      },
      "semantic_refs": [
        "alatyr:bounded-context-expansion@1"
      ],
      "owner_refs": [
        "ALATYR-CONTEXT-001"
      ],
      "estimated_words": 22,
      "content_digest": "sha256:eb34f45ba09982b0141fb4977e5f376339b8dea4c30b6ea88c2085537840bfc3"
    },
    {
      "id": "project.content.debug-readme-md",
      "kind": "content",
      "path": "debug/README.md",
      "summary": "Alatyr Debug Evidence",
      "selectors": {
        "path_terms": [
          "debug"
        ]
      },
      "semantic_refs": [
        "alatyr:bounded-context-expansion@1"
      ],
      "owner_refs": [
        "ALATYR-CONTEXT-001"
      ],
      "estimated_words": 269,
      "content_digest": "sha256:e4fc4406b7609a62a31177be577c0520d2455f7c2df2140ac2cdad1cb9eb0151"
    },
    {
      "id": "project.section.debug-records",
      "kind": "index",
      "path": "debug/records/context-index.json",
      "summary": "Records section",
      "selectors": {
        "path_terms": [
          "records"
        ]
      },
      "semantic_refs": [],
      "owner_refs": [],
      "estimated_words": 80,
      "content_digest": "sha256:2bcdfa695571782c734ed1316db5f78f0547b6908d25b0aef1049a69fae2f730"
    }
  ]
}
