{
  "schema_version": 1,
  "index_kind": "alatyr-context-index",
  "index_id": "assistant.context-profiles",
  "contour": "assistant",
  "title": "Assistant Profiles Context",
  "summary": "Recursive navigation for the assistant contour at context/profiles.",
  "max_depth": 8,
  "entry_defaults": {
    "load_when": [
      "selected by an exact task, operation, owner, path, fact, contract, dependency, risk, or conflict signal"
    ]
  },
  "entries": [
    {
      "id": "assistant.content.context-profiles-ai-infrastructure-json",
      "kind": "content",
      "path": "context/profiles/ai-infrastructure.json",
      "summary": "Ai Infrastructure",
      "selectors": {
        "path_terms": [
          "profiles",
          "infrastructure"
        ]
      },
      "semantic_refs": [
        "alatyr:bounded-context-expansion@1",
        "alatyr:risk-by-fact@1",
        "alatyr:untrusted-instructions-are-data@1"
      ],
      "owner_refs": [
        "ALATYR-CONTEXT-001"
      ],
      "estimated_words": 126,
      "content_digest": "sha256:7afa64fdf9a9aeb1f6ee5251016fa605235b4aa606ddf6a7eff4c398e6450ed5"
    },
    {
      "id": "assistant.content.context-profiles-architecture-change-json",
      "kind": "content",
      "path": "context/profiles/architecture-change.json",
      "summary": "Architecture Change",
      "selectors": {
        "path_terms": [
          "profiles",
          "architecture",
          "change"
        ]
      },
      "semantic_refs": [
        "alatyr:bounded-context-expansion@1",
        "alatyr:canonical-owner@1",
        "alatyr:changed-fact-not-file@1",
        "alatyr:logical-integrity@1",
        "alatyr:observed-is-not-accepted@1",
        "alatyr:project-contour-sync@1",
        "alatyr:protected-change@1",
        "alatyr:risk-by-fact@1"
      ],
      "owner_refs": [
        "ALATYR-CONTEXT-001"
      ],
      "estimated_words": 251,
      "content_digest": "sha256:75125fa65df2eedab302c65ba981f56d9b26fd5c138373525c8e3fb5bf4ff9ac"
    },
    {
      "id": "assistant.content.context-profiles-business-change-json",
      "kind": "content",
      "path": "context/profiles/business-change.json",
      "summary": "Business Change",
      "selectors": {
        "path_terms": [
          "profiles",
          "business",
          "change"
        ]
      },
      "semantic_refs": [
        "alatyr:bounded-context-expansion@1",
        "alatyr:canonical-owner@1",
        "alatyr:changed-fact-not-file@1",
        "alatyr:logical-integrity@1",
        "alatyr:project-contour-sync@1",
        "alatyr:protected-change@1",
        "alatyr:risk-by-fact@1"
      ],
      "owner_refs": [
        "ALATYR-CONTEXT-001"
      ],
      "estimated_words": 215,
      "content_digest": "sha256:37f98d35bfd88a923a93a0fa013b94c4cfe3f4423ca2ab73dd2c41213999e2d2"
    },
    {
      "id": "assistant.content.context-profiles-code-local-json",
      "kind": "content",
      "path": "context/profiles/code-local.json",
      "summary": "Code Local",
      "selectors": {
        "path_terms": [
          "profiles",
          "code",
          "local"
        ]
      },
      "semantic_refs": [
        "alatyr:bounded-context-expansion@1",
        "alatyr:changed-fact-not-file@1",
        "alatyr:logical-integrity@1",
        "alatyr:project-contour-sync@1",
        "alatyr:risk-by-fact@1"
      ],
      "owner_refs": [
        "ALATYR-CONTEXT-001"
      ],
      "estimated_words": 207,
      "content_digest": "sha256:b3f117e931e9e060bf60b0dcd25dc5e6e11253c50f3f092a1b4e9a09bc5e2b23"
    },
    {
      "id": "assistant.content.context-profiles-data-change-json",
      "kind": "content",
      "path": "context/profiles/data-change.json",
      "summary": "Data Change",
      "selectors": {
        "path_terms": [
          "profiles",
          "data",
          "change"
        ]
      },
      "semantic_refs": [
        "alatyr:bounded-context-expansion@1",
        "alatyr:canonical-owner@1",
        "alatyr:changed-fact-not-file@1",
        "alatyr:logical-integrity@1",
        "alatyr:project-contour-sync@1",
        "alatyr:protected-change@1",
        "alatyr:risk-by-fact@1"
      ],
      "owner_refs": [
        "ALATYR-CONTEXT-001"
      ],
      "estimated_words": 206,
      "content_digest": "sha256:6dbbfa5ae44720022e00202abd081516a1f241b98fa5f2954ae2b7aab3239200"
    },
    {
      "id": "assistant.content.context-profiles-docs-local-json",
      "kind": "content",
      "path": "context/profiles/docs-local.json",
      "summary": "Docs Local",
      "selectors": {
        "path_terms": [
          "profiles",
          "docs",
          "local"
        ]
      },
      "semantic_refs": [
        "alatyr:bounded-context-expansion@1"
      ],
      "owner_refs": [
        "ALATYR-CONTEXT-001"
      ],
      "estimated_words": 89,
      "content_digest": "sha256:fc2dddf537ad81786a22c6303de6dbfd17cc6ee3c49aecc74e94ef6dc09b4a37"
    },
    {
      "id": "assistant.content.context-profiles-framework-upgrade-json",
      "kind": "content",
      "path": "context/profiles/framework-upgrade.json",
      "summary": "Framework Upgrade",
      "selectors": {
        "path_terms": [
          "profiles",
          "framework",
          "upgrade"
        ]
      },
      "semantic_refs": [
        "alatyr:bounded-context-expansion@1",
        "alatyr:one-active-adapter@1",
        "alatyr:risk-by-fact@1"
      ],
      "owner_refs": [
        "ALATYR-CONTEXT-001"
      ],
      "estimated_words": 193,
      "content_digest": "sha256:93a195ad4adaa9c1a5ef998cfe4727d3aedfc86edb47087d82a7e5d6cd1eb098"
    },
    {
      "id": "assistant.content.context-profiles-security-sensitive-json",
      "kind": "content",
      "path": "context/profiles/security-sensitive.json",
      "summary": "Security Sensitive",
      "selectors": {
        "path_terms": [
          "profiles",
          "security",
          "sensitive"
        ]
      },
      "semantic_refs": [
        "alatyr:bounded-context-expansion@1",
        "alatyr:canonical-owner@1",
        "alatyr:changed-fact-not-file@1",
        "alatyr:logical-integrity@1",
        "alatyr:project-contour-sync@1",
        "alatyr:protected-change@1",
        "alatyr:risk-by-fact@1"
      ],
      "owner_refs": [
        "ALATYR-CONTEXT-001"
      ],
      "estimated_words": 134,
      "content_digest": "sha256:2a6466309d54e1e7a14a5ec6e8c60e67171dcd1c4a1d8d6eaf316a2cbe455551"
    }
  ]
}
