{
  "schema_version": 1,
  "index_kind": "alatyr-context-index",
  "index_id": "assistant.checklists",
  "contour": "assistant",
  "title": "Assistant Checklists Context",
  "summary": "Recursive navigation for the assistant contour at checklists.",
  "max_depth": 8,
  "entry_defaults": {
    "load_when": [
      "selected by an exact task, operation, owner, path, fact, contract, dependency, risk, or conflict signal"
    ]
  },
  "entries": [
    {
      "id": "assistant.content.checklists-change-impact-md",
      "kind": "content",
      "path": "checklists/change-impact.md",
      "summary": "Change Impact Checklist",
      "selectors": {
        "path_terms": [
          "checklists",
          "change",
          "impact"
        ]
      },
      "semantic_refs": [
        "alatyr:bounded-context-expansion@1"
      ],
      "owner_refs": [
        "ALATYR-CONTEXT-001"
      ],
      "estimated_words": 214,
      "content_digest": "sha256:a53c034ae443dfc8cdaf737c952f82be3b3c0befbc71d14be01ef607e906841b"
    }
  ]
}
