{
  "schema_version": 1,
  "index_kind": "alatyr-context-index",
  "index_id": "framework.support",
  "contour": "framework",
  "title": "Support Framework Context",
  "summary": "Bounded support framework rules and supporting guidance.",
  "max_depth": 8,
  "entry_defaults": {
    "load_when": [
      "selected by an exact task, operation, owner, path, fact, contract, dependency, risk, or conflict signal"
    ]
  },
  "entries": [
    {
      "id": "framework.support.allowed-actions-json",
      "kind": "content",
      "path": "allowed-actions.json",
      "summary": "Allowed Actions",
      "selectors": {
        "path_terms": [
          "allowed",
          "actions"
        ]
      },
      "semantic_refs": [],
      "owner_refs": [],
      "estimated_words": 129,
      "content_digest": "sha256:7692d6338de50d9887a084b8828f0171f2b4f018ee744916edec988d5d9852b8"
    },
    {
      "id": "framework.support.ascii-diagrams-md",
      "kind": "content",
      "path": "ascii-diagrams.md",
      "summary": "Portable ASCII Diagrams",
      "selectors": {
        "path_terms": [
          "ascii",
          "diagrams"
        ]
      },
      "semantic_refs": [],
      "owner_refs": [],
      "estimated_words": 771,
      "content_digest": "sha256:5ca399d6bcddd74b7ff14ef9cca70b256730fc912aecc2fc274ca79a62bcc5f8"
    },
    {
      "id": "framework.support.effectiveness-metrics-md",
      "kind": "content",
      "path": "effectiveness-metrics.md",
      "summary": "Effectiveness Metrics",
      "selectors": {
        "path_terms": [
          "effectiveness",
          "metrics"
        ]
      },
      "semantic_refs": [],
      "owner_refs": [],
      "estimated_words": 1275,
      "content_digest": "sha256:1b40dfe7964b099a2d37a4e395bf429c92b963f22bb3e2035180e877ecab5758"
    },
    {
      "id": "framework.support.runtime-observation-md",
      "kind": "content",
      "path": "runtime-observation.md",
      "summary": "Runtime Observation",
      "selectors": {
        "path_terms": [
          "runtime",
          "observation"
        ]
      },
      "semantic_refs": [],
      "owner_refs": [],
      "estimated_words": 406,
      "content_digest": "sha256:9337c9b420ccc69ec5e3bd179abdcaa75d552cbf770be7b25d5ff1e75f168a26"
    },
    {
      "id": "framework.support.session-continuity-md",
      "kind": "content",
      "path": "session-continuity.md",
      "summary": "Session Continuity",
      "selectors": {
        "path_terms": [
          "session",
          "continuity"
        ],
        "rule_ids": [
          "ALATYR-CONTINUITY-001"
        ]
      },
      "semantic_refs": [],
      "owner_refs": [
        "ALATYR-CONTINUITY-001"
      ],
      "estimated_words": 1096,
      "content_digest": "sha256:133bfa6f8a85b154c65938da87ec03b0d810a1a6764b8eae1a1d3e07b1396b64"
    },
    {
      "id": "framework.support.support-information-md",
      "kind": "content",
      "path": "support-information.md",
      "summary": "Support Information",
      "selectors": {
        "path_terms": [
          "support",
          "information"
        ],
        "rule_ids": [
          "ALATYR-SUPPORT-001"
        ]
      },
      "semantic_refs": [
        "alatyr:bounded-impact-closure@1",
        "alatyr:relationship-candidate-is-not-authority@1",
        "alatyr:support-state-is-a-locator@1"
      ],
      "owner_refs": [
        "ALATYR-SUPPORT-001"
      ],
      "estimated_words": 1747,
      "content_digest": "sha256:e0ddb0db9de52f8944f954e0d7e28a4428e2fe61c0f4a5674d0e193d0c15dce8"
    },
    {
      "id": "framework.support.task-classes-json",
      "kind": "content",
      "path": "task-classes.json",
      "summary": "Task Classes",
      "selectors": {
        "path_terms": [
          "task",
          "classes"
        ]
      },
      "semantic_refs": [],
      "owner_refs": [],
      "estimated_words": 279,
      "content_digest": "sha256:8ff71c3275becae25f4c2301f93d87ab8ea362003f3708707c7837b0c266b5ac"
    },
    {
      "id": "framework.support.test-first-development-md",
      "kind": "content",
      "path": "test-first-development.md",
      "summary": "Test-First Development",
      "selectors": {
        "path_terms": [
          "test",
          "first",
          "development"
        ],
        "rule_ids": [
          "ALATYR-TDD-001"
        ]
      },
      "semantic_refs": [],
      "owner_refs": [
        "ALATYR-TDD-001"
      ],
      "estimated_words": 1153,
      "content_digest": "sha256:0494df75ebb9c7f9eb1b6a633ff7e6d1d99f3ee47d0360ef9c860e3f1f7e02a7"
    }
  ]
}
