{
  "schema_version": 1,
  "index_kind": "alatyr-context-index",
  "index_id": "framework.collaboration",
  "contour": "framework",
  "title": "Collaboration Framework Context",
  "summary": "Bounded collaboration framework rules and supporting guidance.",
  "max_depth": 8,
  "entry_defaults": {
    "load_when": [
      "selected by an exact task, operation, owner, path, fact, contract, dependency, risk, or conflict signal"
    ]
  },
  "entries": [
    {
      "id": "framework.collaboration.large-task-orchestration-md",
      "kind": "content",
      "path": "large-task-orchestration.md",
      "summary": "Large-Task Orchestration",
      "selectors": {
        "path_terms": [
          "large",
          "task",
          "orchestration"
        ]
      },
      "semantic_refs": [],
      "owner_refs": [],
      "estimated_words": 1591,
      "content_digest": "sha256:9387e7d77cd485770002972277033faffe5590a538f0ef837bd0ef0433ec4a7c"
    },
    {
      "id": "framework.collaboration.subagent-delegation-md",
      "kind": "content",
      "path": "subagent-delegation.md",
      "summary": "Subagent Delegation",
      "selectors": {
        "path_terms": [
          "subagent",
          "delegation"
        ],
        "rule_ids": [
          "ALATYR-DELEGATION-001"
        ]
      },
      "semantic_refs": [
        "alatyr:bounded-delegation@1"
      ],
      "owner_refs": [
        "ALATYR-DELEGATION-001"
      ],
      "estimated_words": 3371,
      "content_digest": "sha256:9ed5c70aacb89af5852318706d94f936386a693ef3a6937c292f8febeef36fc9"
    },
    {
      "id": "framework.collaboration.task-decomposition-md",
      "kind": "content",
      "path": "task-decomposition.md",
      "summary": "Task Decomposition",
      "selectors": {
        "path_terms": [
          "task",
          "decomposition"
        ],
        "rule_ids": [
          "ALATYR-DECOMPOSITION-001"
        ]
      },
      "semantic_refs": [],
      "owner_refs": [
        "ALATYR-DECOMPOSITION-001"
      ],
      "estimated_words": 2822,
      "content_digest": "sha256:9137f5603fdf526070a0349123c94d42fb7c3e649fb5692ce626fc08387089b6"
    },
    {
      "id": "framework.collaboration.team-collaboration-md",
      "kind": "content",
      "path": "team-collaboration.md",
      "summary": "Team Collaboration",
      "selectors": {
        "path_terms": [
          "team",
          "collaboration"
        ],
        "rule_ids": [
          "ALATYR-TEAM-001"
        ]
      },
      "semantic_refs": [],
      "owner_refs": [
        "ALATYR-TEAM-001"
      ],
      "estimated_words": 2460,
      "content_digest": "sha256:3c0370214ab9056f5bae51f8ef561c68cc5778f8b98195efc12c82b1bd1db223"
    },
    {
      "id": "framework.collaboration.workspace-modes-md",
      "kind": "content",
      "path": "workspace-modes.md",
      "summary": "Workspace Modes",
      "selectors": {
        "path_terms": [
          "workspace",
          "modes"
        ],
        "rule_ids": [
          "ALATYR-MODE-001"
        ]
      },
      "semantic_refs": [
        "alatyr:mode-does-not-grant-authority@1"
      ],
      "owner_refs": [
        "ALATYR-MODE-001"
      ],
      "estimated_words": 1382,
      "content_digest": "sha256:dc1b84f72ca465f735d51ee5de02d3c26fd8054688556b4f11c1663eddc239da"
    }
  ]
}
