{
  "schema_version": 1,
  "index_kind": "alatyr-context-index",
  "index_id": "project.engineering-evidence-records",
  "contour": "project",
  "title": "Project Records Context",
  "summary": "Recursive navigation for the project contour at engineering-evidence/records.",
  "max_depth": 8,
  "entry_defaults": {
    "load_when": [
      "selected by an exact task, operation, owner, path, fact, contract, dependency, risk, or conflict signal"
    ]
  },
  "entries": [
    {
      "id": "project.content.engineering-evidence-records-readme-md",
      "kind": "content",
      "path": "engineering-evidence/records/README.md",
      "summary": "Engineering Evidence Records",
      "selectors": {
        "path_terms": [
          "engineering",
          "evidence",
          "records"
        ]
      },
      "semantic_refs": [
        "alatyr:bounded-context-expansion@1"
      ],
      "owner_refs": [
        "ALATYR-CONTEXT-001"
      ],
      "estimated_words": 111,
      "content_digest": "sha256:25b93363471636e589474dd06aeaff48771bfcb05f97b5b1f9a4d15c02e33c3c"
    }
  ]
}
