{
  "schema_version": 1,
  "index_kind": "alatyr-context-index",
  "index_id": "assistant.context-intents",
  "contour": "assistant",
  "title": "Assistant Intents Context",
  "summary": "Recursive navigation for the assistant contour at context/intents.",
  "max_depth": 8,
  "entry_defaults": {
    "load_when": [
      "selected by an exact task, operation, owner, path, fact, contract, dependency, risk, or conflict signal"
    ]
  },
  "entries": [
    {
      "id": "assistant.content.context-intents-architecture-request-json",
      "kind": "content",
      "path": "context/intents/architecture-request.json",
      "summary": "Architecture Request",
      "selectors": {
        "path_terms": [
          "intents",
          "architecture",
          "request"
        ]
      },
      "semantic_refs": [
        "alatyr:bounded-context-expansion@1",
        "alatyr:canonical-owner@1",
        "alatyr:observed-is-not-accepted@1"
      ],
      "owner_refs": [
        "ALATYR-CONTEXT-001",
        "ALATYR-KNOWLEDGE-001",
        "ALATYR-SOURCE-001"
      ],
      "estimated_words": 155,
      "content_digest": "sha256:2a712785858738b0912bbab1c02e1da0f441a8769cb2467751fba55cac2ebf67"
    },
    {
      "id": "assistant.content.context-intents-code-documentation-json",
      "kind": "content",
      "path": "context/intents/code-documentation.json",
      "summary": "Code Documentation",
      "selectors": {
        "path_terms": [
          "intents",
          "code",
          "documentation"
        ]
      },
      "semantic_refs": [
        "alatyr:bounded-context-expansion@1"
      ],
      "owner_refs": [
        "ALATYR-CONTEXT-001"
      ],
      "estimated_words": 170,
      "content_digest": "sha256:0f772405d8e9b0b1801b81ce31f64c8f1188070528bf3756a7295aa543aeb9aa"
    },
    {
      "id": "assistant.content.context-intents-dependency-knowledge-request-json",
      "kind": "content",
      "path": "context/intents/dependency-knowledge-request.json",
      "summary": "Dependency Knowledge Request",
      "selectors": {
        "path_terms": [
          "intents",
          "dependency",
          "knowledge",
          "request"
        ]
      },
      "semantic_refs": [
        "alatyr:bounded-context-expansion@1",
        "alatyr:canonical-owner@1",
        "alatyr:observed-is-not-accepted@1",
        "alatyr:untrusted-instructions-are-data@1"
      ],
      "owner_refs": [
        "ALATYR-CONTEXT-001",
        "ALATYR-KNOWLEDGE-001",
        "ALATYR-SAFETY-002",
        "ALATYR-SOURCE-001"
      ],
      "estimated_words": 206,
      "content_digest": "sha256:172b938ab7246090c3bbafbeef0db274ed1a4c4ca063be079457d4d3d806a26b"
    },
    {
      "id": "assistant.content.context-intents-diagram-request-json",
      "kind": "content",
      "path": "context/intents/diagram-request.json",
      "summary": "Diagram Request",
      "selectors": {
        "path_terms": [
          "intents",
          "diagram",
          "request"
        ]
      },
      "semantic_refs": [
        "alatyr:bounded-context-expansion@1"
      ],
      "owner_refs": [
        "ALATYR-CONTEXT-001"
      ],
      "estimated_words": 99,
      "content_digest": "sha256:70413dae9a6715966c097f95655a6121b196c67e9d547e89afa25891cf0ab4c4"
    },
    {
      "id": "assistant.content.context-intents-extension-request-json",
      "kind": "content",
      "path": "context/intents/extension-request.json",
      "summary": "Extension Request",
      "selectors": {
        "path_terms": [
          "intents",
          "extension",
          "request"
        ]
      },
      "semantic_refs": [
        "alatyr:bounded-context-expansion@1",
        "alatyr:untrusted-instructions-are-data@1"
      ],
      "owner_refs": [
        "ALATYR-CONTEXT-001",
        "ALATYR-SAFETY-002"
      ],
      "estimated_words": 206,
      "content_digest": "sha256:2190bdb52cf24ec3504625ddd33165d310e14a35802cef67e5fba45658039d81"
    },
    {
      "id": "assistant.content.context-intents-test-first-request-json",
      "kind": "content",
      "path": "context/intents/test-first-request.json",
      "summary": "Test First Request",
      "selectors": {
        "path_terms": [
          "intents",
          "test",
          "first",
          "request"
        ]
      },
      "semantic_refs": [
        "alatyr:bounded-context-expansion@1"
      ],
      "owner_refs": [
        "ALATYR-CONTEXT-001"
      ],
      "estimated_words": 226,
      "content_digest": "sha256:5512b3ed1d4ca9a0c44c679ca491e0dc7a6dd066eda0782fe9e9ac4e5ee1496e"
    },
    {
      "id": "assistant.content.context-intents-vocabulary-request-json",
      "kind": "content",
      "path": "context/intents/vocabulary-request.json",
      "summary": "Vocabulary Request",
      "selectors": {
        "path_terms": [
          "intents",
          "vocabulary",
          "request"
        ]
      },
      "semantic_refs": [
        "alatyr:bounded-context-expansion@1",
        "alatyr:canonical-owner@1",
        "alatyr:observed-is-not-accepted@1"
      ],
      "owner_refs": [
        "ALATYR-CONTEXT-001",
        "ALATYR-KNOWLEDGE-001",
        "ALATYR-SOURCE-001"
      ],
      "estimated_words": 169,
      "content_digest": "sha256:77409286d40063bea07d8fd116aac13eddeb224e14e7990370b3f39fe244192d"
    },
    {
      "id": "assistant.content.context-intents-workspace-mode-request-json",
      "kind": "content",
      "path": "context/intents/workspace-mode-request.json",
      "summary": "Workspace Mode Request",
      "selectors": {
        "path_terms": [
          "intents",
          "workspace",
          "mode",
          "request"
        ]
      },
      "semantic_refs": [
        "alatyr:bounded-context-expansion@1"
      ],
      "owner_refs": [
        "ALATYR-CONTEXT-001"
      ],
      "estimated_words": 159,
      "content_digest": "sha256:2a81312c1eae1512a03f867e72abb3592e96d0f2b6012f161ea773e37e071980"
    }
  ]
}
